{
  "$schema": "../../web/schemas/resources.schema.json",
  "title": "GDG DevFest Season 2018",
  "description": "Join the community, learn new things!",
  "keywords": "event, gdg, gde, devfest, google, programming, android, chrome, polymer, developers, web, cloud, androiddev",
  "heroDescriptions": {
    "home": "Join the commuity, learn new things!",
    "attending": "Everything you need to get to GDG DevFest Ukraine, and to join it online.",
    "speakers": "Hear from the Googlers, Partners, and Guest Speakers who are building the future of cloud. Check back often as we add more speakers, including our customers and partners."
  },
  "aboutBlock": {
    "callToAction": {
      "featuredSessions": {
        "description": "GDG DevFest Ukraine brings together the world class experts in Android, Web and Cloud technologies to Lviv for 2 days of sessions, workshops and showcases.",
        "label": "Explore featured session",
        "link": "https://www.youtube.com/playlist?list=PLt8lEzcLNl31AouwDkbLbLARlQFwNS2en"
      },
      "howItWas": {
        "description": "Described by many as 'Google I/O of Ukraine', our team creates DevFest to be the best place for experience sharing in a phenomenal atmosphere.",
        "label": "See how it was in 2016",
        "youtubeId": "TdpbgRgz6eE"
      }
    },
    "statisticsBlock": {
      "attendees": {
        "label": "Attendees",
        "number": "900",
        "emoji": "🎉"
      },
      "days": {
        "label": "Days",
        "number": "2"
      },
      "sessions": {
        "label": "Sessions",
        "number": "50"
      },
      "tracks": {
        "label": "Tracks",
        "number": "4"
      }
    }
  },
  "aboutOrganizerBlock": {
    "image": "/images/team.jpg",
    "blocks": [
      {
        "title": "Organizer",
        "description": "<a href='http://lviv.gdg.org.ua' target='_blank'>GDG Lviv</a> with support of 10 GDGs from all around Ukraine is proud organizer of DevFest Ukraine",
        "callToAction": {
          "label": "Open team page",
          "link": "/team"
        }
      },
      {
        "title": "What is a GDG?",
        "description": "A Google Developer Group is a community of volunteers who create exciting projects and share experiences about Google technologies.",
        "callToAction": {
          "label": "Read more",
          "link": "https://developers.google.com/groups/",
          "newTab": true
        }
      },
      {
        "title": "What is DevFest?",
        "description": "DevFests are community-led developer events hosted by Google Developer Groups around the globe.",
        "callToAction": {
          "label": "Read more",
          "link": "https://devfest.withgoogle.com/",
          "newTab": true
        }
      }
    ]
  },
  "team": {
    "description": "Google is known all around the world. Everyone is 'googling', checking on 'maps' and communicating in 'gmail'. For simple users, they are services that just works, but not for us. Developers see much more: APIs, scalability issues, complex technology stacks. And that is what GDG is about.<br><br> [Google Developers Group (GDG) Lviv](http://lviv.gdg.org.ua/) - is open and volunteer geek community who create exciting projects and share experience about Google technologies with a passion.<br><br> Our goal is to organize space to connect the best industry experts with Ukrainian audience to boost development of IT."
  },
  "ticketsBlock": {
    "ticketsDetails": "Tickets grant access to all conference sections, coffee breaks, lunch and party. Accommodation is NOT included in the ticket price."
  },
  "featuredVideos": {
    "title": "DFUA'16 featured videos",
    "callToAction": {
      "link": "https://www.youtube.com/playlist?list=PLt8lEzcLNl31AouwDkbLbLARlQFwNS2en"
    }
  },
  "nfpBlock": {
    "title": "About the organizer",
    "lines": [
      "Describe your organization here."
    ]
  },
  "galleryBlock": {
    "title": "#dfua16 highlights",
    "description": "This year's festival built lots of excitement. Check out photos from featured talks, hands-on learning sessions, and after-hours fun.",
    "callToAction": {
      "link": "https://goo.gl/photos/H8s3CtPexCzkLqSt9"
    }
  },
  "subscribeBlock": {
    "formTitle": "Get the latest updates, insights and news about GDG DevFest Ukraine sent to your inbox."
  },
  "codeOfConductBlock": {
    "form": "https://bit.ly/2RstTJ8",
    "contacts": [
      "Organizer Oleh Zasadnyy, [+38 093 486 6460](tel:+380934866460), o.zasadnyy@gdg.org.ua",
      "Organizer Sofiya Huts, [+38 093 486 1425](tel:+380934861425), s.huts@gdg.org.ua"
    ]
  },
  "footerRelBlock": [
    {
      "title": "About",
      "links": [
        {
          "name": "GDG Lviv",
          "url": "http://lviv.gdg.org.ua/",
          "newTab": true
        },
        {
          "name": "GDG",
          "url": "https://developers.google.com/groups/",
          "newTab": true
        },
        {
          "name": "DevFest",
          "url": "https://devfest.withgoogle.com/",
          "newTab": true
        },
        {
          "name": "Meet the Team",
          "url": "https://devfest.gdg.org.ua/team/",
          "newTab": true
        }
      ]
    },
    {
      "title": "Explore Past DevFests",
      "links": [
        {
          "name": "DFUA 2013",
          "url": "http://gdg-devfest-ua.appspot.com/",
          "newTab": true
        },
        {
          "name": "DFUA 2014",
          "url": "https://dfua14.web.app/",
          "newTab": true
        },
        {
          "name": "DFUA 2015",
          "url": "https://dfua15.web.app/",
          "newTab": true
        },
        {
          "name": "DFUA 2016",
          "url": "https://dfua16.web.app/",
          "newTab": true
        }
      ]
    },
    {
      "title": "Event Resources",
      "links": [
        {
          "name": "Partnership Proposition",
          "url": "https://devfest.gdg.org.ua/assets/GDG_DevFest_2016_partnership_proposition.pdf",
          "newTab": true
        },
        {
          "name": "Info Partnership Proposition",
          "url": "https://devfest.gdg.org.ua/assets/GDG_DevFest_2016_partnership_proposition.pdf",
          "newTab": true
        },
        {
          "name": "Media Kit",
          "url": "https://devfest.gdg.org.ua/assets/GDG_DevFest_2016_partnership_proposition.pdf",
          "newTab": true
        },
        {
          "name": "Call for Papers",
          "url": "https://drive.google.com/open?id=10tPuu_7ASM8C70SotqRqIW5Uzos9BzALilMMQPg_JvA",
          "newTab": true
        },
        {
          "name": "FAQs",
          "url": "/faq",
          "newTab": false
        }
      ]
    }
  ],
  "mapBlock": {
    "description": "Newly built Pivdennyi Expo is a long-awaited exhibition center in Lviv, which can fulfill the needs of the large-scale event"
  },
  "attendingPage": {
    "description": "How to get to GDG DevFest Ukraine in Lviv, when the doors open, and what to expect at the venue.",
    "online": "Ask questions in the chat under the stream. Speakers answer them at the end of their talk.",
    "gettingThere": [
      {
        "mode": "train",
        "text": "From Lviv railway station, the venue is about 20 minutes away by taxi."
      },
      {
        "mode": "plane",
        "text": "From Lviv airport, the venue is about 15 minutes away by taxi."
      },
      {
        "mode": "parking",
        "text": "Parking is free for attendees. Show your ticket at the gate."
      },
      {
        "mode": "other",
        "title": "By rocket",
        "text": "Land on the roof. We'll take care of it."
      }
    ],
    "doors": [
      {
        "day": "2017-10-13",
        "open": "08:00",
        "close": "20:00",
        "note": "Registration is at the main entrance. Bring your ticket, on your phone or on paper."
      },
      {
        "day": "2017-10-14",
        "open": "08:30",
        "close": "19:00"
      }
    ],
    "accessibility": "Every room is step-free, with lifts between floors. Tell us what you need when you register, or ask any volunteer in a DevFest t-shirt.",
    "accommodation": {
      "text": "We have a discount at a hotel next to the venue.",
      "hotels": [
        {
          "name": "Hotel Example",
          "address": "1 Example St, Lviv",
          "note": "Rooms from 1,200 UAH a night.",
          "code": "DEVFEST",
          "url": "https://example.com/book"
        }
      ]
    },
    "atVenue": [
      {
        "topic": "wifi",
        "text": "Network `DevFest`, password `devfest2017`."
      },
      {
        "topic": "food",
        "text": "Lunch and coffee are included. Tell us about allergies when you register."
      },
      {
        "topic": "cloakroom",
        "text": "Free, next to registration."
      }
    ]
  }
}
